Description,Phenotype,Trait type,Sex,Category,Info,N cases,N controls,P-Value (SKAT-O),Beta,Select,,analysis_id
N20 Calculus of kidney and ureter,132036,icd_first_occurrence,,Health-related outcomes > First occurrences > Genitourinary system disorders,,4243,277342,0.833213526757324,-0.0405025812909365,,,icd_first_occurrence-132036-both_sexes--
"N31 Neuromuscular dysfunction of bladder, not elsewhere classified",132056,icd_first_occurrence,,Health-related outcomes > First occurrences > Genitourinary system disorders,,2761,278824,0.833629784886817,-0.0405219760395925,,,icd_first_occurrence-132056-both_sexes--
B00 Herpesviral [herpes simplex] infections,130174,icd_first_occurrence,,Health-related outcomes > First occurrences > Certain infectious and parasitic diseases,,2702,278883,0.834049968184338,-0.0405094890074491,,,icd_first_occurrence-130174-both_sexes--
"Volume of grey matter in Inferior Temporal Gyrus, anterior division (left)",25808,continuous,,UK Biobank Assessment Centre > Imaging > Brain MRI > T1 structural brain MRI > Regional grey matter volumes (FAST),,16047,,0.834338733158214,,,,continuous-25808-both_sexes--irnt
Weighted-mean FA in tract corticospinal tract (right),25497,continuous,,UK Biobank Assessment Centre > Imaging > Brain MRI > Diffusion brain MRI > dMRI weighted means,,14490,,0.834819266732199,,,,continuous-25497-both_sexes--irnt
Weighted-mean MO in tract anterior thalamic radiation (left),25544,continuous,,UK Biobank Assessment Centre > Imaging > Brain MRI > Diffusion brain MRI > dMRI weighted means,,14490,,0.835117197060329,,,,continuous-25544-both_sexes--irnt
Mean arterial pressure during PWA,12687,continuous,,UK Biobank Assessment Centre > Imaging > Heart MRI > Pulse wave analysis,,17183,,0.83530973908794,,,,continuous-12687-both_sexes--irnt
D70 Agranulocytosis,130660,icd_first_occurrence,,"Health-related outcomes > First occurrences > Blood, blood-forming organs and certain immune disorders",,2902,278683,0.835409957955876,-0.0404789167167363,,,icd_first_occurrence-130660-both_sexes--
Tonsiltis,20002,categorical,,UK Biobank Assessment Centre > Verbal interview > Medical conditions,,2262,279281,0.835494863249004,-0.0408150805624775,,,categorical-20002-both_sexes-1598-
L91 Hypertrophic disorders of skin,131824,icd_first_occurrence,,Health-related outcomes > First occurrences > Skin and subcutaneous tissue disorders,,2770,278815,0.835837015435057,-0.0406576263637803,,,icd_first_occurrence-131824-both_sexes--
Z49.3 Skin of anterior trunk,41210,categorical,,Health-related outcomes > Hospital inpatient > Summary Operations,,3080,278506,0.836113168620313,-0.0404456946214043,,,categorical-41210-both_sexes-Z493-
K66 Other disorders of peritoneum,131654,icd_first_occurrence,,Health-related outcomes > First occurrences > Digestive system disorders,,2906,278679,0.836405537396132,-0.0404707685382395,,,icd_first_occurrence-131654-both_sexes--
Vasectomy,20004,categorical,,UK Biobank Assessment Centre > Verbal interview > Operations,,6847,121368,0.836429602032438,-0.0419068261275919,,,categorical-20004-both_sexes-1218-
K63.6 Coronary arteriography NEC,41200,categorical,,Health-related outcomes > Hospital inpatient > Summary Operations,,4010,277576,0.836536523771226,-0.0406818194412328,,,categorical-41200-both_sexes-K636-
Z47.3 Skin of cheek,41210,categorical,,Health-related outcomes > Hospital inpatient > Summary Operations,,2946,278640,0.837012230149775,-0.0404946226561736,,,categorical-41210-both_sexes-Z473-
Mean L2 in middle cerebellar peduncle on FA skeleton,25248,continuous,,UK Biobank Assessment Centre > Imaging > Brain MRI > Diffusion brain MRI > dMRI skeleton,,14492,,0.837693115833877,,,,continuous-25248-both_sexes--irnt
Stroke,20002,categorical,,UK Biobank Assessment Centre > Verbal interview > Medical conditions,,3651,277892,0.838469025602917,-0.0406577079342802,,,categorical-20002-both_sexes-1081-
Adcal-d3 1.5g/10micrograms chewable tablet,20003,categorical,,UK Biobank Assessment Centre > Verbal interview > Medications,,1957,279586,0.838663118013825,-0.0407251507322573,,,categorical-20003-both_sexes-1141164828-
Y81.9 Unspecified spinal anaesthetic,41210,categorical,,Health-related outcomes > Hospital inpatient > Summary Operations,,2375,279211,0.83882264247248,-0.0411784941738205,,,categorical-41210-both_sexes-Y819-
Weighted-mean L2 in tract acoustic radiation (left),25596,continuous,,UK Biobank Assessment Centre > Imaging > Brain MRI > Diffusion brain MRI > dMRI weighted means,,14490,,0.83919620428142,,,,continuous-25596-both_sexes--irnt
Y84.2 Sedation NEC,41210,categorical,,Health-related outcomes > Hospital inpatient > Summary Operations,,2406,279180,0.839541339619654,-0.0408612620626263,,,categorical-41210-both_sexes-Y842-
Basal cell carcinoma,20001,categorical,,UK Biobank Assessment Centre > Verbal interview > Medical conditions,,2607,278936,0.839654057402446,-0.0405726838900429,,,categorical-20001-both_sexes-1061-
B95 Streptococcus and staphylococcus as the cause of diseases classified to other chapters,130336,icd_first_occurrence,,Health-related outcomes > First occurrences > Certain infectious and parasitic diseases,,3299,278286,0.839889353040943,-0.0404736470876441,,,icd_first_occurrence-130336-both_sexes--
X72.3 Delivery of simple parenteral chemotherapy for neoplasm at first attendance,41210,categorical,,Health-related outcomes > Hospital inpatient > Summary Operations,,2386,279200,0.840055894077191,-0.0404997324200126,,,categorical-41210-both_sexes-X723-
G25 Other extrapyramidal and movement disorders,131032,icd_first_occurrence,,Health-related outcomes > First occurrences > Nervous system disorders,,2602,278983,0.84021025990808,-0.0405384628670168,,,icd_first_occurrence-131032-both_sexes--
Candesartan cilexetil,20003,categorical,,UK Biobank Assessment Centre > Verbal interview > Medications,,3099,278444,0.840308775528822,-0.0405727593661902,,,categorical-20003-both_sexes-1141156836-
Q10.3 Dilation of cervix uteri and curettage of uterus NEC,41200,categorical,,Health-related outcomes > Hospital inpatient > Summary Operations,,2708,150640,0.840343529738255,-0.0406115313591075,,,categorical-41200-both_sexes-Q103-
Weighted-mean L1 in tract superior longitudinal fasciculus (left),25590,continuous,,UK Biobank Assessment Centre > Imaging > Brain MRI > Diffusion brain MRI > dMRI weighted means,,14490,,0.840347477281286,,,,continuous-25590-both_sexes--irnt
Age last used hormone-replacement therapy (HRT),3546,continuous,,UK Biobank Assessment Centre > Touchscreen > Sex-specific factors > Female-specific factors,,44368,,0.841389590750377,0.00624208946958061,,,continuous-3546-both_sexes--irnt
Mean L1 in superior longitudinal fasciculus on FA skeleton (left),25241,continuous,,UK Biobank Assessment Centre > Imaging > Brain MRI > Diffusion brain MRI > dMRI skeleton,,14492,,0.841616361186147,,,,continuous-25241-both_sexes--irnt
Mean MO in retrolenticular part of internal capsule on FA skeleton (left),25173,continuous,,UK Biobank Assessment Centre > Imaging > Brain MRI > Diffusion brain MRI > dMRI skeleton,,14492,,0.841680792359408,,,,continuous-25173-both_sexes--irnt
Weighted-mean OD in tract inferior longitudinal fasciculus (right),25692,continuous,,UK Biobank Assessment Centre > Imaging > Brain MRI > Diffusion brain MRI > dMRI weighted means,,14489,,0.842260598056535,,,,continuous-25692-both_sexes--irnt
K42 Umbilical hernia,131616,icd_first_occurrence,,Health-related outcomes > First occurrences > Digestive system disorders,,4051,277534,0.842601370380052,-0.0405119883124264,,,icd_first_occurrence-131616-both_sexes--
Weighted-mean FA in tract anterior thalamic radiation (right),25491,continuous,,UK Biobank Assessment Centre > Imaging > Brain MRI > Diffusion brain MRI > dMRI weighted means,,14490,,0.842770942278388,,,,continuous-25491-both_sexes--irnt
C12.1 Excision of lesion of eyelid NEC,41200,categorical,,Health-related outcomes > Hospital inpatient > Summary Operations,,2759,278827,0.843042711906035,-0.040466747652568,,,categorical-41200-both_sexes-C121-
Y53.9 Unspecified approach to organ under image control,41210,categorical,,Health-related outcomes > Hospital inpatient > Summary Operations,,3463,278123,0.843511684108563,-0.0405437834430721,,,categorical-41210-both_sexes-Y539-
Mean L2 in splenium of corpus callosum on FA skeleton,25252,continuous,,UK Biobank Assessment Centre > Imaging > Brain MRI > Diffusion brain MRI > dMRI skeleton,,14492,,0.843559359129844,,,,continuous-25252-both_sexes--irnt
K51 Ulcerative colitis,131628,icd_first_occurrence,,Health-related outcomes > First occurrences > Digestive system disorders,,3184,278401,0.843751775031203,-0.0404326604942501,,,icd_first_occurrence-131628-both_sexes--
Mean ICVF in posterior corona radiata on FA skeleton (right),25370,continuous,,UK Biobank Assessment Centre > Imaging > Brain MRI > Diffusion brain MRI > dMRI skeleton,,14490,,0.843884612706348,,,,continuous-25370-both_sexes--irnt
Median z-statistic (in group-defined mask) for faces-shapes contrast,25050,continuous,,UK Biobank Assessment Centre > Imaging > Brain MRI > Task functional brain MRI,,14069,,0.84404535915878,,,,continuous-25050-both_sexes--irnt
Alcohol drinker status,20117,categorical,,UK Biobank Assessment Centre > Touchscreen > Lifestyle and environment > Alcohol,,9028,272130,0.844199274797643,0.0101899557019758,,,categorical-20117-both_sexes-0-
Z94.2 Right sided operation,41210,categorical,,Health-related outcomes > Hospital inpatient > Summary Operations,,80087,201499,0.844233057130932,-0.00712581388131513,,,categorical-41210-both_sexes-Z942-
Z84.3 Hip joint,41210,categorical,,Health-related outcomes > Hospital inpatient > Summary Operations,,2592,278994,0.84460248949382,-0.0404797088182811,,,categorical-41210-both_sexes-Z843-
Allergy or anaphylactic reaction to drug,20002,categorical,,UK Biobank Assessment Centre > Verbal interview > Medical conditions,,2442,279101,0.844781329037209,-0.0404399110157698,,,categorical-20002-both_sexes-1386-
Caesarean section / caesarian section,20004,categorical,,UK Biobank Assessment Centre > Verbal interview > Operations,,14489,138839,0.845087826754505,-0.0142380068243475,,,categorical-20004-both_sexes-1477-
L81 Other disorders of pigmentation,131804,icd_first_occurrence,,Health-related outcomes > First occurrences > Skin and subcutaneous tissue disorders,,2462,279123,0.84553092254214,-0.0404839313087471,,,icd_first_occurrence-131804-both_sexes--
Weighted-mean L2 in tract posterior thalamic radiation (right),25616,continuous,,UK Biobank Assessment Centre > Imaging > Brain MRI > Diffusion brain MRI > dMRI weighted means,,14490,,0.845668526179611,,,,continuous-25616-both_sexes--irnt
Leg fat-free mass (right),23113,continuous,,UK Biobank Assessment Centre > Physical measures > Anthropometry > Impedance measures,,276681,,0.846391485068253,0.000423777545960283,,,continuous-23113-both_sexes--irnt
Weighted-mean L1 in tract acoustic radiation (right),25570,continuous,,UK Biobank Assessment Centre > Imaging > Brain MRI > Diffusion brain MRI > dMRI weighted means,,14490,,0.84646280940907,,,,continuous-25570-both_sexes--irnt
W20.1 Primary open reduction of fracture of long bone and extramedullary fixation using plate NEC,41200,categorical,,Health-related outcomes > Hospital inpatient > Summary Operations,,2350,279236,0.846794932243167,-0.0404330780003798,,,categorical-41200-both_sexes-W201-
K90 Intestinal malabsorption,131688,icd_first_occurrence,,Health-related outcomes > First occurrences > Digestive system disorders,,2378,279207,0.847203150174887,-0.0405203327456908,,,icd_first_occurrence-131688-both_sexes--
Glaucoma,20002,categorical,,UK Biobank Assessment Centre > Verbal interview > Medical conditions,,2899,278644,0.847259800137686,-0.0406380891313341,,,categorical-20002-both_sexes-1277-
Headaches (not migraine),20002,categorical,,UK Biobank Assessment Centre > Verbal interview > Medical conditions,,2348,279195,0.847293454183022,-0.0404422930767251,,,categorical-20002-both_sexes-1436-
90th percentile of BOLD effect (in group-defined mask) for shapes activation,25761,continuous,,UK Biobank Assessment Centre > Imaging > Brain MRI > Task functional brain MRI,,14069,,0.847508807984881,,,,continuous-25761-both_sexes--irnt
Hyperthyroidism/thyrotoxicosis,20002,categorical,,UK Biobank Assessment Centre > Verbal interview > Medical conditions,,2140,279403,0.848085857823646,-0.0405075613262927,,,categorical-20002-both_sexes-1225-
Volume of grey matter in Paracingulate Gyrus (right),25837,continuous,,UK Biobank Assessment Centre > Imaging > Brain MRI > T1 structural brain MRI > Regional grey matter volumes (FAST),,16047,,0.848109471851667,,,,continuous-25837-both_sexes--irnt
Weighted-mean ICVF in tract medial lemniscus (right),25668,continuous,,UK Biobank Assessment Centre > Imaging > Brain MRI > Diffusion brain MRI > dMRI weighted means,,14489,,0.849254797306372,,,,continuous-25668-both_sexes--irnt
Volume of white matter,25008,continuous,,UK Biobank Assessment Centre > Imaging > Brain MRI > T1 structural brain MRI,,16052,,0.850166615172998,,,,continuous-25008-both_sexes--irnt
A55.9 Unspecified diagnostic spinal puncture,41200,categorical,,Health-related outcomes > Hospital inpatient > Summary Operations,,2550,279036,0.850239362204778,-0.0404143492240188,,,categorical-41200-both_sexes-A559-
Total sugars,100008,continuous,,Online follow-up > Diet by 24-hour recall > Estimated nutrients yesterday,,43938,,0.850856569642223,0.00706260535431976,,,continuous-100008-both_sexes--irnt
Volume of grey matter in Frontal Medial Cortex (right),25831,continuous,,UK Biobank Assessment Centre > Imaging > Brain MRI > T1 structural brain MRI > Regional grey matter volumes (FAST),,16047,,0.851439550623904,,,,continuous-25831-both_sexes--irnt
Pulse wave reflection index,4195,continuous,,UK Biobank Assessment Centre > Physical measures > Arterial stiffness,,101696,,0.851936259112577,0.00479346639791731,,,continuous-4195-both_sexes--irnt
Ever used hormone-replacement therapy (HRT),2814,categorical,,UK Biobank Assessment Centre > Touchscreen > Sex-specific factors > Female-specific factors,,59542,93303,0.852068176221611,0.00950110046891772,,,categorical-2814-both_sexes--
Mean MO in genu of corpus callosum on FA skeleton,25154,continuous,,UK Biobank Assessment Centre > Imaging > Brain MRI > Diffusion brain MRI > dMRI skeleton,,14492,,0.852346719448919,,,,continuous-25154-both_sexes--irnt
Mean L3 in superior corona radiata on FA skeleton (right),25320,continuous,,UK Biobank Assessment Centre > Imaging > Brain MRI > Diffusion brain MRI > dMRI skeleton,,14492,,0.852370763035728,,,,continuous-25320-both_sexes--irnt
Q01.3 Excision of lesion of cervix uteri,41200,categorical,,Health-related outcomes > Hospital inpatient > Summary Operations,,1667,151681,0.852947748513129,-0.0405123653705779,,,categorical-41200-both_sexes-Q013-
"ECG, heart rate",5983,continuous,,UK Biobank Assessment Centre > Physical measures > ECG during exercise,,53138,,0.852958949079273,0.00281119981153039,,,continuous-5983-both_sexes--irnt
I63 Cerebral infarction,131366,icd_first_occurrence,,Health-related outcomes > First occurrences > Circulatory system disorders,,3189,278396,0.853342297459142,-0.0406491155581436,,,icd_first_occurrence-131366-both_sexes--
T43.9 Unspecified diagnostic endoscopic examination of peritoneum,41200,categorical,,Health-related outcomes > Hospital inpatient > Summary Operations,,1952,151396,0.853352767150423,-0.0407462875356873,,,categorical-41200-both_sexes-T439-
Volume of amygdala (left),25021,continuous,,UK Biobank Assessment Centre > Imaging > Brain MRI > T1 structural brain MRI > Subcortical volumes (FIRST),,16038,,0.853635283805759,,,,continuous-25021-both_sexes--irnt
H22.9 Unspecified diagnostic endoscopic examination of colon,41210,categorical,,Health-related outcomes > Hospital inpatient > Summary Operations,,2641,278945,0.854464962732034,-0.0404187600679188,,,categorical-41210-both_sexes-H229-
Beclometasone,20003,categorical,,UK Biobank Assessment Centre > Verbal interview > Medications,,2536,279007,0.854839665917174,-0.0403929818409819,,,categorical-20003-both_sexes-1140909786-
Spine arthritis/spondylitis,20002,categorical,,UK Biobank Assessment Centre > Verbal interview > Medical conditions,,2439,279104,0.854882541151333,-0.0404568227549466,,,categorical-20002-both_sexes-1311-
N23 Unspecified renal colic,132042,icd_first_occurrence,,Health-related outcomes > First occurrences > Genitourinary system disorders,,3153,278432,0.8549187804928,-0.0404199151391015,,,icd_first_occurrence-132042-both_sexes--
E86 Volume depletion,130826,icd_first_occurrence,,"Health-related outcomes > First occurrences > Endocrine, nutritional and metabolic diseases",,2734,278851,0.85499078313126,-0.0405045730721537,,,icd_first_occurrence-130826-both_sexes--
Mean L2 in superior longitudinal fasciculus on FA skeleton (left),25289,continuous,,UK Biobank Assessment Centre > Imaging > Brain MRI > Diffusion brain MRI > dMRI skeleton,,14492,,0.855032152087472,,,,continuous-25289-both_sexes--irnt
Volume of grey matter in Middle Frontal Gyrus (left),25788,continuous,,UK Biobank Assessment Centre > Imaging > Brain MRI > T1 structural brain MRI > Regional grey matter volumes (FAST),,16047,,0.855070211530587,,,,continuous-25788-both_sexes--irnt
X35.2 Intravenous chemotherapy,41200,categorical,,Health-related outcomes > Hospital inpatient > Summary Operations,,2402,279184,0.855187890130162,-0.0404107508880771,,,categorical-41200-both_sexes-X352-
Muscle/soft tissue problem,20002,categorical,,UK Biobank Assessment Centre > Verbal interview > Medical conditions,,2157,279386,0.855330159048697,-0.0403839817653032,,,categorical-20002-both_sexes-1297-
Wheeze or whistling in the chest in last year,2316,categorical,,UK Biobank Assessment Centre > Touchscreen > Health and medical history > Breathing,,57451,218677,0.855416860873174,-0.00975440742966229,,,categorical-2316-both_sexes--
Unilateral oophorectomy,20004,categorical,,UK Biobank Assessment Centre > Verbal interview > Operations,,1692,151636,0.855533685095158,-0.0404751384712302,,,categorical-20004-both_sexes-1356-
Myomectomy/fibroids removed,20004,categorical,,UK Biobank Assessment Centre > Verbal interview > Operations,,1594,151734,0.855639679816727,-0.0404800179729538,,,categorical-20004-both_sexes-1509-
Weighted-mean OD in tract posterior thalamic radiation (left),25696,continuous,,UK Biobank Assessment Centre > Imaging > Brain MRI > Diffusion brain MRI > dMRI weighted means,,14489,,0.856766159829111,,,,continuous-25696-both_sexes--irnt
X72.1 Delivery of complex chemotherapy for neoplasm including prolonged infusional treatment at first attendance,41210,categorical,,Health-related outcomes > Hospital inpatient > Summary Operations,,2360,279226,0.856830509720816,-0.0404652182193728,,,categorical-41210-both_sexes-X721-
Doxazosin,20003,categorical,,UK Biobank Assessment Centre > Verbal interview > Medications,,3105,278438,0.857145900650335,-0.0406900002740401,,,categorical-20003-both_sexes-1140879778-
Sciatica,20002,categorical,,UK Biobank Assessment Centre > Verbal interview > Medical conditions,,2619,278924,0.857505239652974,-0.0403780653777455,,,categorical-20002-both_sexes-1476-
Mean MD in posterior corona radiata on FA skeleton (left),25131,continuous,,UK Biobank Assessment Centre > Imaging > Brain MRI > Diffusion brain MRI > dMRI skeleton,,14492,,0.857748415459249,,,,continuous-25131-both_sexes--irnt
"Volume of grey matter in Middle Temporal Gyrus, temporooccipital part (right)",25807,continuous,,UK Biobank Assessment Centre > Imaging > Brain MRI > T1 structural brain MRI > Regional grey matter volumes (FAST),,16047,,0.857773983048637,,,,continuous-25807-both_sexes--irnt
M24 Other specific joint derangements,131886,icd_first_occurrence,,Health-related outcomes > First occurrences > Musculoskeletal system and connective tissue disorders,,2450,279135,0.857852462866765,-0.0403762104491816,,,icd_first_occurrence-131886-both_sexes--
Q12.1 Introduction of intrauterine contraceptive device,41210,categorical,,Health-related outcomes > Hospital inpatient > Summary Operations,,1601,151747,0.857975668063459,-0.0408202175064069,,,categorical-41210-both_sexes-Q121-
I67 Other cerebrovascular diseases,131374,icd_first_occurrence,,Health-related outcomes > First occurrences > Circulatory system disorders,,2745,278840,0.858228385753207,-0.040611856420198,,,icd_first_occurrence-131374-both_sexes--
Alcohol drinker status,20117,categorical,,UK Biobank Assessment Centre > Touchscreen > Lifestyle and environment > Alcohol,,262484,18674,0.858657777244744,0.0142744702007893,,,categorical-20117-both_sexes-2-
Mean MO in retrolenticular part of internal capsule on FA skeleton (right),25172,continuous,,UK Biobank Assessment Centre > Imaging > Brain MRI > Diffusion brain MRI > dMRI skeleton,,14492,,0.858784706830781,,,,continuous-25172-both_sexes--irnt
Z50.3 Skin of finger,41210,categorical,,Health-related outcomes > Hospital inpatient > Summary Operations,,2801,278785,0.858880456576094,-0.0403839267360639,,,categorical-41210-both_sexes-Z503-
Longest period of mania or irritability,20492,continuous,,Online follow-up > Mental health > Mania,,22219,,0.858960213450346,0.00712370981878434,,,continuous-20492-both_sexes--
Folic acid product,20003,categorical,,UK Biobank Assessment Centre > Verbal interview > Medications,,2364,279179,0.859388726183212,-0.0404109161761016,,,categorical-20003-both_sexes-1140870422-
Eye surgery,20004,categorical,,UK Biobank Assessment Centre > Verbal interview > Operations,,2575,278968,0.860062574101393,-0.0403658054374389,,,categorical-20004-both_sexes-1434-
Z48.2 Skin of neck,41210,categorical,,Health-related outcomes > Hospital inpatient > Summary Operations,,2767,278819,0.86015192768306,-0.0403927426166264,,,categorical-41210-both_sexes-Z482-
"Volume of grey matter in Inferior Temporal Gyrus, posterior division (right)",25811,continuous,,UK Biobank Assessment Centre > Imaging > Brain MRI > T1 structural brain MRI > Regional grey matter volumes (FAST),,16047,,0.860179832925591,,,,continuous-25811-both_sexes--irnt
U20.1 Transthoracic echocardiography,41210,categorical,,Health-related outcomes > Hospital inpatient > Summary Operations,,3148,278438,0.860434196713435,-0.0405826564685353,,,categorical-41210-both_sexes-U201-
Mean ISOVF in anterior limb of internal capsule on FA skeleton (right),25456,continuous,,UK Biobank Assessment Centre > Imaging > Brain MRI > Diffusion brain MRI > dMRI skeleton,,14490,,0.860753341070842,,,,continuous-25456-both_sexes--irnt
Mean FA in superior corona radiata on FA skeleton (left),25081,continuous,,UK Biobank Assessment Centre > Imaging > Brain MRI > Diffusion brain MRI > dMRI skeleton,,14492,,0.860836337606526,,,,continuous-25081-both_sexes--irnt
Weighted-mean L2 in tract anterior thalamic radiation (right),25599,continuous,,UK Biobank Assessment Centre > Imaging > Brain MRI > Diffusion brain MRI > dMRI weighted means,,14490,,0.861037696015391,,,,continuous-25599-both_sexes--irnt
"Blood clot, DVT, bronchitis, emphysema, asthma, rhinitis, eczema, allergy diagnosed by doctor",6152,categorical,,UK Biobank Assessment Centre > Touchscreen > Health and medical history > Medical conditions,,2317,278682,0.861117279529417,-0.0404022590672686,,,categorical-6152-both_sexes-7-
L87.1 Stripping of long saphenous vein,41210,categorical,,Health-related outcomes > Hospital inpatient > Summary Operations,,2181,279405,0.861239088011341,-0.0403936546006729,,,categorical-41210-both_sexes-L871-
K62 Other diseases of anus and rectum,131646,icd_first_occurrence,,Health-related outcomes > First occurrences > Digestive system disorders,,22314,259271,0.861774327702941,-0.0141256729738262,,,icd_first_occurrence-131646-both_sexes--
Calcium salts,20003,categorical,,UK Biobank Assessment Centre > Verbal interview > Medications,,1730,279813,0.862016638904331,-0.0404475110436999,,,categorical-20003-both_sexes-1140870788-
Pulmonary embolism +/- dvt,20002,categorical,,UK Biobank Assessment Centre > Verbal interview > Medical conditions,,2304,279239,0.862308126811422,-0.0403974426522751,,,categorical-20002-both_sexes-1093-
M21 Other acquired deformities of limbs,131880,icd_first_occurrence,,Health-related outcomes > First occurrences > Musculoskeletal system and connective tissue disorders,,2306,279279,0.862628276459211,-0.0403868209048554,,,icd_first_occurrence-131880-both_sexes--
Y98.3 Radiology of three body areas (or 20-40 minutes),41210,categorical,,Health-related outcomes > Hospital inpatient > Summary Operations,,2596,278990,0.86273120658432,-0.0404826070102109,,,categorical-41210-both_sexes-Y983-
J47 Bronchiectasis,131498,icd_first_occurrence,,Health-related outcomes > First occurrences > Respiratory system disorders,,2311,279274,0.862979844080597,-0.0405172258655933,,,icd_first_occurrence-131498-both_sexes--
O29.1 Subacromial decompression,41200,categorical,,Health-related outcomes > Hospital inpatient > Summary Operations,,2357,279229,0.863694607244208,-0.0403525006093383,,,categorical-41200-both_sexes-O291-
Mean L2 in posterior limb of internal capsule on FA skeleton (right),25266,continuous,,UK Biobank Assessment Centre > Imaging > Brain MRI > Diffusion brain MRI > dMRI skeleton,,14492,,0.863697514721477,,,,continuous-25266-both_sexes--irnt
B06 Rubella [german measles],130186,icd_first_occurrence,,Health-related outcomes > First occurrences > Certain infectious and parasitic diseases,,1963,279622,0.863886702027759,-0.0404271992832912,,,icd_first_occurrence-130186-both_sexes--
Mean OD in superior fronto-occipital fasciculus on FA skeleton (left),25435,continuous,,UK Biobank Assessment Centre > Imaging > Brain MRI > Diffusion brain MRI > dMRI skeleton,,14490,,0.86398457616847,,,,continuous-25435-both_sexes--irnt
"ECG, load",5984,continuous,,UK Biobank Assessment Centre > Physical measures > ECG during exercise,,53191,,0.864057529123417,-0.00297033864444439,,,continuous-5984-both_sexes--irnt
